{
  "$schema": "https://json-schema.org/draft/2020-12/schema",
  "title": "LessonExtraction",
  "type": "object",
  "additionalProperties": false,
  "required": ["student", "instrument", "highlights", "focus_areas", "assignments", "evidence"],
  "properties": {
    "student": { "type": "string", "minLength": 1 },
    "instrument": { "type": "string", "minLength": 1 },
    "highlights": { "type": "array", "items": { "type": "string" }, "minItems": 1 },
    "focus_areas": { "type": "array", "items": { "type": "string" }, "minItems": 1 },
    "assignments": {
      "type": "array",
      "minItems": 1,
      "items": {
        "type": "object",
        "additionalProperties": false,
        "required": ["task", "target", "confidence"],
        "properties": {
          "task": { "type": "string", "minLength": 1 },
          "target": { "type": "string", "minLength": 1 },
          "confidence": { "type": "number", "minimum": 0, "maximum": 1 }
        }
      }
    },
    "evidence": {
      "type": "array",
      "items": {
        "type": "object",
        "additionalProperties": false,
        "required": ["claim", "quote"],
        "properties": {
          "claim": { "type": "string", "minLength": 1 },
          "quote": { "type": "string", "minLength": 1 }
        }
      }
    }
  }
}
